{
  "$id": "https://cmn.dev/schemas/v1/spore-core.json",
  "$schema": "https://json-schema.org/draft/2020-12/schema",
  "title": "CMN Spore Core",
  "description": "Schema for spore.core.json — the core metadata file maintained in git repositories. This is the local draft that hypha release reads to produce the full spore.json manifest.",
  "type": "object",
  "required": ["name", "domain", "key", "synopsis", "intent", "license", "tree"],
  "properties": {
    "$schema": {
      "const": "https://cmn.dev/schemas/v1/spore-core.json"
    },
    "id": {
      "type": "string",
      "minLength": 1,
      "pattern": "^[^./\\\\:*?\"<>|\\s\\u0000-\\u001f\\u007f][^/\\\\:*?\"<>|\\s\\u0000-\\u001f\\u007f]*$",
      "description": "Filesystem-safe identifier. Cannot start with dot, cannot contain /\\:*?\"<>|, whitespace, or control characters."
    },
    "version": {
      "type": "string",
      "description": "Human-readable version string (e.g., 1.0.0). Optional."
    },
    "name": { "type": "string", "minLength": 1, "description": "Human-readable display name" },
    "domain": {
      "type": "string",
      "pattern": "^(?:[a-z0-9](?:[a-z0-9-]{0,61}[a-z0-9])?\\.)+[a-z0-9](?:[a-z0-9-]{0,61}[a-z0-9])?$"
    },
    "key": {
      "type": "string",
      "pattern": "^ed25519\\.[1-9A-HJ-NP-Za-km-z]+$",
      "description": "Author's public key embedded at release time. Enables offline verification without fetching cmn.json."
    },
    "synopsis": { "type": "string", "description": "One-line summary — agent reads this alone and understands what the spore does" },
    "intent": { "type": "array", "items": { "type": "string" }, "description": "Multi-paragraph description of this spore's functionality and purpose — what it does, how it works, why it exists. Each array item is a paragraph. Permanent, not cleared on release." },
    "mutations": { "type": "array", "items": { "type": "string" }, "default": [], "description": "What changed relative to the spawned_from parent — describes the mutations applied to derive this spore from its ancestor." },
    "license": { "$ref": "#/$defs/spdx_expression_simple" },
    "bonds": {
      "type": "array",
      "items": { "$ref": "#/$defs/bond" }
    },
    "tree": { "$ref": "#/$defs/tree" },
    "updated_at_epoch_ms": { "type": "integer", "minimum": 0, "description": "Content update timestamp (milliseconds since Unix epoch). Recommended source: latest Git commit time for the source tree, with max file mtime as fallback." }
  },
  "additionalProperties": true,
  "$defs": {
    "spdx_expression_simple": {
      "type": "string",
      "minLength": 1,
      "pattern": "^[A-Za-z0-9-.+():]+(?:\\s+(?:AND|OR|WITH)\\s+[A-Za-z0-9-.+():]+)*$",
      "description": "SPDX license expression (basic pattern validation). Full SPDX parser validation is recommended."
    },
    "cmn_uri": {
      "type": "string",
      "pattern": "^cmn://(?:[a-z0-9](?:[a-z0-9-]{0,61}[a-z0-9])?\\.)+[a-z0-9](?:[a-z0-9-]{0,61}[a-z0-9])?/[a-z0-9]+\\.[1-9A-HJ-NP-Za-km-z]+$",
      "description": "CMN URI format: cmn://{domain}/{algorithm}.{base58}"
    },
    "bond": {
      "type": "object",
      "required": ["uri", "relation"],
      "properties": {
        "uri": { "$ref": "#/$defs/cmn_uri" },
        "relation": {
          "type": "string",
          "minLength": 1,
          "description": "Relationship type. Predefined types: spawned_from, absorbed_from, depends_on, follows, implements, inspired_by, related_to. Custom types allowed."
        },
        "id": {
          "type": "string",
          "minLength": 1,
          "description": "Optional identifier for this bond. Bond-fetch command uses it as the directory name under .cmn/bonds/ (e.g. .cmn/bonds/strain-account/) instead of the hash."
        },
        "reason": {
          "type": "string",
          "minLength": 1,
          "description": "Optional explanation of why this bond exists and what role it plays. Most useful for depends_on, follows, implements, and absorbed_from relations. Typically omitted for spawned_from (use mutations field instead)."
        },
        "with": {
          "type": "object",
          "description": "Bond-specific parameters whose schema is defined by the bonded spore's convention. Opaque to the CMN protocol."
        }
      },
      "additionalProperties": true
    },
    "tree": {
      "type": "object",
      "required": ["algorithm"],
      "properties": {
        "algorithm": { "type": "string", "description": "Tree hash algorithm (e.g., blob_tree_blake3_nfc)" },
        "exclude_names": { "type": "array", "items": { "type": "string" } },
        "follow_rules": { "type": "array", "items": { "type": "string" } }
      },
      "additionalProperties": true
    }
  }
}
